{
  "description": "Depth-band dungeon source selection plus representative v29 generated dungeon equipment drops.",
  "world_id": "dungeon_levels",
  "required_templates": [
    "long_sword",
    "great_sword",
    "bow",
    "shield",
    "helm",
    "leather_cap",
    "tiara",
    "mail",
    "leather_vest",
    "full_plate",
    "gloves",
    "cloth_wraps",
    "gauntlets",
    "belt",
    "boots",
    "soft_boots",
    "plate_boots",
    "ring",
    "amulet"
  ],
  "bands": [
    {
      "level": -1,
      "depth": 1,
      "monster_loot_table": "dungeon_mob_drop_depth_1",
      "chest_loot_table": "guarded_chest_drop_depth_1"
    },
    {
      "level": -2,
      "depth": 2,
      "monster_loot_table": "dungeon_mob_drop_depth_2",
      "chest_loot_table": "guarded_chest_drop_depth_2"
    },
    {
      "level": -3,
      "depth": 3,
      "monster_loot_table": "dungeon_mob_drop_depth_3_plus",
      "chest_loot_table": "guarded_chest_drop_depth_3_plus"
    },
    {
      "level": -10,
      "depth": 10,
      "monster_loot_table": "dungeon_mob_drop_depth_3_plus",
      "chest_loot_table": "guarded_chest_drop_depth_3_plus"
    }
  ],
  "cases": [
    {
      "name": "depth_3_monster_single_bow",
      "level": -3,
      "source": "monster",
      "loot_table": "dungeon_mob_drop_depth_3_plus",
      "treasure_class_id": "dungeon_mob_tc_depth_3_plus",
      "seed": "v29_dungeon_mob_tc_depth_3_plus_41",
      "expected_drops": [
        {
          "item_template_id": "mail"
        }
      ]
    },
    {
      "name": "depth_3_chest_bow",
      "level": -3,
      "source": "chest",
      "loot_table": "guarded_chest_drop_depth_3_plus",
      "treasure_class_id": "guarded_chest_tc_depth_3_plus",
      "seed": "v29_guarded_chest_tc_depth_3_plus_5",
      "expected_drops": [
        {
          "item_template_id": "dagger"
        }
      ]
    },
    {
      "name": "depth_3_chest_potion_bonus",
      "level": -3,
      "source": "chest",
      "loot_table": "guarded_chest_drop_depth_3_plus",
      "treasure_class_id": "guarded_chest_tc_depth_3_plus",
      "seed": "v29_guarded_chest_tc_depth_3_plus_8",
      "expected_drops": [
        {
          "item_template_id": "war_girdle"
        },
        {
          "item_template_id": "short_spear"
        }
      ]
    }
  ]
}
